{
  "title": "Legal AI Scaffold",
  "scope": "service",
  "bounded_context": "legal_ai",
  "description": "Reserve the gateway, contracts, and service seams for the initial SHAP Legal AI proof of concept.",
  "use_cases": [
    "Reserve the legal-ai gateway route and downstream service boundary.",
    "Expose a placeholder legal-ai endpoint that proves the scaffold is wired correctly.",
    "Keep contracts and runtime helpers ready for the later vertical-slice implementation."
  ],
  "commands": [
    "Refresh scaffold status metadata."
  ],
  "queries": [
    "Read scaffold readiness metadata."
  ],
  "events_emitted": [
    "PlaceholderReserved"
  ],
  "events_consumed": [],
  "api_endpoints": [
    {
      "method": "GET",
      "path": "/legal-ai/ping",
      "purpose": "Return placeholder legal-ai scaffold metadata."
    }
  ],
  "data_ownership": {
    "service_database": "legal_ai_db",
    "owned_entities": [
      "reserved legal-ai scaffold state"
    ],
    "cross_service_access": "No direct cross-service database reads or writes."
  },
  "dependencies": [
    "gateway_service",
    "shap_service_runtime",
    "shap_contracts",
    "postgres"
  ],
  "security_constraints": [
    "Gateway remains the only auth-token validation boundary.",
    "Downstream services trust signed user-context headers in local development mode.",
    "Critical runtime configuration must be validated at startup."
  ],
  "observability": {
    "logs": [
      "startup validation",
      "migration/readiness failures"
    ],
    "metrics": [
      "health and readiness endpoints",
      "HTTP request counters and latency"
    ],
    "alerts": []
  },
  "test_plan": {
    "unit": [
      "Placeholder scaffold service response"
    ],
    "contract": [
      "Gateway reserved route shape"
    ],
    "integration": [
      "Docker Compose boot and health checks"
    ],
    "acceptance": [
      "Gateway forwards /legal-ai/ping to legal_ai_service"
    ]
  }
}
